{
  "$schema": "../trip.schema.json",
  "version": "1.0",
  "meta": {
    "id": "boston-2026",
    "title": "Boston 2026",
    "subtitle": "Aug 8 – 12 · Downtown · North End · Harbor · Cambridge",
    "timezone": "America/New_York",
    "homeTimezone": "America/Chicago",
    "dateRange": {
      "start": "2026-08-08",
      "end": "2026-08-12"
    },
    "dayIdPattern": "aug{N}",
    "primaryHotelId": "hotel-boston",
    "branding": {
      "appId": "com.steve.boston2026",
      "appName": "Boston 2026",
      "packageName": "boston-travel-app"
    },
    "features": {
      "currency": false,
      "expenses": true,
      "bingo": true,
      "phrases": true
    }
  },
  "themeImages": {
    "boston": "/images/boston.jpg",
    "northend": "/images/northend.jpg",
    "harbor": "/images/harbor.jpg",
    "cambridge": "/images/cambridge.jpg",
    "sports": "/images/sports.jpg",
    "travel": "/images/travel.jpg",
    "food": "/images/food.jpg",
    "fallout": "/images/boston.jpg"
  },
  "members": ["Steve", "Sue", "Kristen"],
  "expenseCategories": ["Meals", "Hotel", "Transport", "Activities", "Groceries", "Other"],
  "places": {
    "hotels": [
      {
        "id": "hotel-boston",
        "name": "Newbury Guest House",
        "address": "261 Newbury St, Boston, MA 02116, USA",
        "city": "Boston",
        "lat": 42.3493,
        "lng": -71.0827,
        "theme": "boston",
        "kind": "hotel",
        "notes": "Back Bay · check-in 3 PM · check-out noon",
        "phone": "+1 617-670-6000",
        "website": "https://www.newburyguesthouse.com/"
      }
    ],
    "stations": [
      {
        "id": "station-logan",
        "name": "Boston Logan International Airport",
        "address": "1 Harborside Dr, Boston, MA 02128",
        "city": "Boston",
        "lat": 42.3656,
        "lng": -71.0096,
        "theme": "travel",
        "kind": "station",
        "notes": "Silver Line SL1 to South Station · ~20–30 min to downtown",
        "website": "https://www.massport.com/logan-airport/"
      },
      {
        "id": "station-south",
        "name": "South Station",
        "address": "700 Atlantic Ave, Boston, MA 02110",
        "city": "Boston",
        "lat": 42.3523,
        "lng": -71.0552,
        "theme": "travel",
        "kind": "station",
        "notes": "Amtrak · MBTA Red Line · bus terminal",
        "website": "https://www.amtrak.com/stations/bos"
      },
      {
        "id": "station-back-bay",
        "name": "Back Bay Station",
        "address": "145 Dartmouth St, Boston, MA 02116",
        "city": "Boston",
        "lat": 42.3473,
        "lng": -71.0755,
        "theme": "travel",
        "kind": "station",
        "notes": "Amtrak & commuter rail",
        "website": "https://www.amtrak.com/stations/bby"
      },
      {
        "id": "meet-north-end-food",
        "name": "North End Food Tour — meetup",
        "address": "156 Blackstone St, Boston, MA 02109",
        "city": "Boston",
        "lat": 42.3618,
        "lng": -71.0568,
        "theme": "northend",
        "kind": "meeting",
        "notes": "Booking YPWZK2GG · Mon 10 Aug 12:00 PM · 6 travellers (Susan Stefanovich) · Meet outside RMV / Boston Public Market entrance · arrive 5–10 min early · Glass-and-metal awning by Surface Rd & Hanover St bus stop · MassDOT sign",
        "website": "https://www.urbanadventures.com/en/boston/boston-north-end-food-tour"
      },
      {
        "id": "meet-old-town-trolley",
        "name": "Old Town Trolley — Copley Square stop",
        "address": "Copley Square / Trinity Church, Boston, MA 02116",
        "city": "Boston",
        "lat": 42.3499,
        "lng": -71.0765,
        "theme": "boston",
        "kind": "meeting",
        "notes": "Sun 9 Aug · all-day hop-on hop-off · start at any stop · nearest to hotel: Copley Square / Trinity Church (Back Bay loop) · show ticket to conductor",
        "website": "https://www.trolleytours.com/boston"
      }
    ],
    "restaurants": [
      {
        "id": "dine-union",
        "name": "Union Oyster House",
        "address": "41 Union St, Boston, MA 02108",
        "city": "Boston",
        "lat": 42.3612,
        "lng": -71.0567,
        "theme": "food",
        "kind": "restaurant",
        "notes": "America's oldest restaurant · chowder & oysters",
        "website": "https://www.unionoysterhouse.com/"
      },
      {
        "id": "dine-regina",
        "name": "Regina Pizzeria (North End)",
        "address": "11½ Thacher St, Boston, MA 02113",
        "city": "Boston",
        "lat": 42.3651,
        "lng": -71.055,
        "theme": "northend",
        "kind": "restaurant",
        "notes": "Cash preferred · expect a line",
        "website": "https://www.pizzeriaregina.com/"
      },
      {
        "id": "dine-mike",
        "name": "Mike's Pastry",
        "address": "300 Hanover St, Boston, MA 02113",
        "city": "Boston",
        "lat": 42.3658,
        "lng": -71.0545,
        "theme": "northend",
        "kind": "restaurant",
        "notes": "Cannoli classic · Hanover St",
        "website": "https://www.mikespastry.com/"
      },
      {
        "id": "dine-legal",
        "name": "Legal Sea Foods (Harbor)",
        "address": "255 State St, Boston, MA 02109",
        "city": "Boston",
        "lat": 42.3592,
        "lng": -71.0515,
        "theme": "harbor",
        "kind": "restaurant",
        "notes": "Clam chowder & lobster roll",
        "website": "https://www.legalseafoods.com/"
      },
      {
        "id": "dine-atlantic",
        "name": "Atlantic Fish",
        "address": "761 Boylston St, Boston, MA 02116",
        "city": "Boston",
        "lat": 42.3485,
        "lng": -71.082,
        "theme": "food",
        "kind": "restaurant",
        "notes": "Sat 8 Aug · reservation 7–9 PM Boston (6–8 PM CDT)",
        "website": "https://www.atlanticfish.com/"
      },
      {
        "id": "dine-piattini",
        "name": "Piattini",
        "address": "226 Newbury St, Boston, MA 02116",
        "city": "Boston",
        "lat": 42.3498,
        "lng": -71.0815,
        "theme": "food",
        "kind": "restaurant",
        "notes": "Sun 9 Aug · reservation 7–9 PM Boston (6–8 PM CDT)",
        "website": "https://www.piattinirestaurant.com/"
      },
      {
        "id": "dine-krasi",
        "name": "Krasi",
        "address": "48 Gloucester St, Boston, MA 02115",
        "city": "Boston",
        "lat": 42.3489,
        "lng": -71.0845,
        "theme": "food",
        "kind": "restaurant",
        "notes": "Mon 10 Aug · reservation 6–8 PM · Greek meze & wine bar",
        "phone": "+1 617-536-0230",
        "website": "https://www.krasiboston.com/"
      },
      {
        "id": "dine-la-voile",
        "name": "La Voile",
        "address": "261 Newbury St, Boston, MA 02116",
        "city": "Boston",
        "lat": 42.3493,
        "lng": -71.0827,
        "theme": "food",
        "kind": "restaurant",
        "notes": "Tue 11 Aug · reservation 5:30–7:30 PM · French brasserie · same building as guest house",
        "phone": "+1 617-587-4200",
        "website": "https://www.lavoilerestaurants.com/la-voile-newbury/"
      }
    ],
    "sights": [
      {
        "id": "sight-common",
        "name": "Boston Common",
        "address": "139 Tremont St, Boston, MA 02111",
        "city": "Boston",
        "lat": 42.3551,
        "lng": -71.0657,
        "theme": "boston",
        "kind": "sight",
        "notes": "Start of the Freedom Trail",
        "website": "https://www.boston.gov/parks/boston-common"
      },
      {
        "id": "sight-garden",
        "name": "Public Garden & Swan Boats",
        "address": "4 Charles St, Boston, MA 02116",
        "city": "Boston",
        "lat": 42.3541,
        "lng": -71.0707,
        "theme": "boston",
        "kind": "sight",
        "website": "https://www.boston.gov/parks/public-garden"
      },
      {
        "id": "sight-faneuil",
        "name": "Faneuil Hall & Quincy Market",
        "address": "4 S Market St, Boston, MA 02109",
        "city": "Boston",
        "lat": 42.3602,
        "lng": -71.0549,
        "theme": "boston",
        "kind": "sight",
        "website": "https://www.nps.gov/bost/planyourvisit/faneuil-hall.htm"
      },
      {
        "id": "sight-aquarium",
        "name": "New England Aquarium",
        "address": "1 Central Wharf, Boston, MA 02110",
        "city": "Boston",
        "lat": 42.3591,
        "lng": -71.0498,
        "theme": "harbor",
        "kind": "sight",
        "website": "https://www.neaq.org/"
      },
      {
        "id": "sight-constitution",
        "name": "USS Constitution & Museum",
        "address": "Building 22, Charlestown Navy Yard, Boston, MA 02129",
        "city": "Boston",
        "lat": 42.3725,
        "lng": -71.0566,
        "theme": "harbor",
        "kind": "sight",
        "notes": "Free tours · arrive early",
        "website": "https://ussconstitutionmuseum.org/"
      },
      {
        "id": "sight-fenway",
        "name": "Fenway Park",
        "address": "4 Jersey St, Boston, MA 02215",
        "city": "Boston",
        "lat": 42.3467,
        "lng": -71.0972,
        "theme": "sports",
        "kind": "sight",
        "notes": "Tour or game if in season",
        "website": "https://www.mlb.com/redsox/ballpark"
      },
      {
        "id": "sight-harvard",
        "name": "Harvard Yard",
        "address": "Cambridge, MA 02138",
        "city": "Cambridge",
        "lat": 42.3744,
        "lng": -71.1182,
        "theme": "cambridge",
        "kind": "sight",
        "website": "https://www.harvard.edu/visit/"
      },
      {
        "id": "sight-mit",
        "name": "MIT Stata Center area",
        "address": "32 Vassar St, Cambridge, MA 02139",
        "city": "Cambridge",
        "lat": 42.3616,
        "lng": -71.0906,
        "theme": "cambridge",
        "kind": "sight",
        "website": "https://www.mit.edu/visit/"
      }
    ]
  },
  "flights": [
    {